<?xml version="1.0" encoding="UTF-8"?>
<!DOCTYPE JMathAnimConfig SYSTEM "JMathAnimConfig.dtd">
<JMathAnimConfig>
    <include>#axes_and_functions_light.xml</include>
    <include>#dots.xml</include>
    <include>#ColorMap_JavaFX.xml</include>
    <background>
        <color>#FDFDFD</color>
    </background>
    <styles>
        <style name="default">
            <drawColor>black</drawColor>
            <fillColor>#00000000</fillColor>
            <thickness>10</thickness>
        </style>
          <style name="dotdefault">
            <drawColor>black</drawColor>
            <fillColor>#00000000</fillColor>
            <thickness>30</thickness>
        </style>  
        <style name="latexdefault">
            <drawColor>black</drawColor>
            <fillColor>black</fillColor>
            <thickness>1</thickness>
        </style>
         <style name="arrowdefault">
            <drawColor>black</drawColor>
            <fillColor>black</fillColor>
            <thickness>4</thickness>
            <scaleArrowHead1>1</scaleArrowHead1>
            <scaleArrowHead2>1</scaleArrowHead2>
        </style>
          <style name="gridPrimaryDefault">
            <drawColor>black</drawColor>
            <fillColor>NONE</fillColor>
            <thickness>2</thickness>
        </style>
        <style name="solidRed">
            <drawColor>black</drawColor>
            <fillColor>#f55652</fillColor>
            <thickness>15</thickness>
        </style>
        <style name="solidBlue">
            <drawColor>black</drawColor>
            <fillColor>#7ca0c0</fillColor>
            <thickness>15</thickness>
        </style>
        <style name="solidGreen">
            <drawColor>black</drawColor>
            <fillColor>#9bc693</fillColor>
            <thickness>15</thickness>
        </style>
        <style name="solidOrange">
            <drawColor>black</drawColor>
            <fillColor>orange</fillColor>
            <thickness>15</thickness>
        </style>
            <style name="1">
            <drawColor>#07004D</drawColor>
            <thickness>30</thickness>
            <dotStyle>circle</dotStyle>
        </style>
        <style name="2">
            <drawColor>#BF2500</drawColor>
            <thickness>30</thickness>
            <dotStyle>cross</dotStyle>
        </style>
        <style name="3">
            <drawColor>#5D2E8C</drawColor>
            <thickness>30</thickness>
            <dotStyle>plus</dotStyle>
        </style>
          <style name="fn1">
            <drawColor>#0F4C5C</drawColor>
            <fillColor>none</fillColor>
            <thickness>8</thickness>
        </style> 
         <style name="fn2">
            <drawColor>#9A031E</drawColor>
            <fillColor>none</fillColor>
            <thickness>8</thickness>
        </style> 
         <style name="fn3">
            <drawColor>#5F0F40</drawColor>
            <fillColor>none</fillColor>
            <dashStyle>DASHED</dashStyle>
            <thickness>4</thickness>
        </style> 
    </styles>
</JMathAnimConfig>
