<?xml version="1.0" encoding="UTF-8"?>
<!DOCTYPE JMathAnimConfig SYSTEM "JMathAnimConfig.dtd">
<JMathAnimConfig>
    <include>#axes_and_functions_dark.xml</include>
    <include>#dots.xml</include>
    <background>
        <color>#000000</color>
    </background>
    <styles>
        <style name="default">
            <drawColor>#FFFFFFFF</drawColor>
            <fillColor>#00000000</fillColor>
            <thickness>10</thickness>
        </style> 
        <style name="dotdefault">
            <drawColor>#FFFFFFFF</drawColor>
            <fillColor>#00000000</fillColor>
            <thickness>30</thickness>
        </style>  
        <style name="latexdefault">
            <drawColor>#FFFFFFFF</drawColor>
            <fillColor>#FFFFFFFF</fillColor>
            <thickness>1</thickness>
        </style>
        <style name="arrowdefault">
            <drawColor>#FFFFFFFF</drawColor>
            <fillColor>#FFFFFFFF</fillColor>
            <thickness>4</thickness>
            <scaleArrowHead1>1</scaleArrowHead1>
            <scaleArrowHead2>1</scaleArrowHead2>
        </style>
    <style name="contourHighlight">
        <drawColor>green</drawColor>
        <fillColor>none</fillColor>
        <thickness>30</thickness>
    </style>
        
        
    <style name="solidRed">
        <drawColor>WHITE</drawColor>
        <fillColor>#f55652</fillColor>
        <thickness>15</thickness>
    </style>
    <style name="solidBlue">
        <drawColor>WHITE</drawColor>
        <fillColor>#7ca0c0</fillColor>
        <thickness>15</thickness>
    </style>
    <style name="solidGreen">
        <drawColor>WHITE</drawColor>
        <fillColor>#9bc693</fillColor>
        <thickness>15</thickness>
    </style>
    <style name="solidOrange">
        <drawColor>WHITE</drawColor>
        <fillColor>orange</fillColor>
        <thickness>15</thickness>
    </style>
    <style name="fn1">
        <drawColor>#277DA1</drawColor>
        <fillColor>none</fillColor>
        <thickness>10</thickness>
    </style> 
    <style name="fn2">
        <drawColor>#F94144</drawColor>
        <fillColor>none</fillColor>
        <thickness>10</thickness>
    </style> 
    <style name="fn3">
        <drawColor>#F9C74F</drawColor>
        <fillColor>none</fillColor>
        <dashStyle>DASHED</dashStyle>
        <thickness>8</thickness>
    </style> 
    </styles>
     <include>#latexStylesDark.xml</include>
</JMathAnimConfig>
