<?xml version="1.0" encoding="UTF-8"?>
<!DOCTYPE JMathAnimConfig SYSTEM "JMathAnimConfig.dtd">
<JMathAnimConfig>  
    <styles>
        <style name="redCircle">
            <drawColor>RED</drawColor>
            <thickness>30</thickness>
            <dotStyle>circle</dotStyle>
        </style>
        <style name="blueCross">
            <drawColor>#6ca2e0</drawColor>
            <thickness>30</thickness>
            <dotStyle>cross</dotStyle>
        </style>
        <style name="yellowPlus">
            <drawColor>#FCE16D</drawColor>
            <thickness>30</thickness>
            <dotStyle>plus</dotStyle>
        </style>
    </styles>
</JMathAnimConfig>